{"asset_type":"prompt","files":[{"byte_length":936,"bytes_base64":"LS0tCmRlc2NyaXB0aW9uOiBWZXJpZnkgYmVoYXZpb3Igd2l0aCB0aGUgQ29kZXggY29tcGFjdCBBU0sgcHJvZmlsZS4KLS0tCgpFbnRyeSBtb2RlIGlzIGZpeGVkIHRvIHZlcmlmaWNhdGlvbi4gUHJpbWFyeSBjb250cmFjdDogYHRlc3QtZmlyc3QtdmVyaWZpY2F0aW9uYC4gQXBwbHkgdGhlIHJlcXVlc3RlZCBjb250cmFjdHMgaW4gdGhlIGdlbmVyYXRlZCBwcm9maWxlIGhlYWRlciBkaXJlY3RseS4KCnt7QVNLX0NPTVBBQ1RfQ09OVFJPTFN9fQoKe3tBU0tfQ09NUEFDVF9ESVJFQ1RfVFJJR0dFUlN9fQoKVmVyaWZpY2F0aW9uIENvbnRyYWN0OgotIEFydGlmYWN0IElEOgotIEFydGlmYWN0IHR5cGU6IHZlcmlmaWNhdGlvbgotIFVwc3RyZWFtIHJlZnM6Ci0gQmVoYXZpb3IgdG8gcHJvdmU6Ci0gRm9jdXNlZCBjaGVja3M6Ci0gRXZpZGVuY2UgcmVxdWlyZWQ6Ci0gSW5zdWZmaWNpZW50LWV2aWRlbmNlIGNvbmRpdGlvbnM6Ci0gRXZpZGVuY2UgcmVxdWlyZWQgYmVmb3JlIGNvbXBsZXRpb24gY2xhaW06CgpFdmlkZW5jZToKLSBWZXJpZmljYXRpb24gQ29udHJhY3QgcmVmOgotIGNvbW1hbmQ6CiAgcmVzdWx0OgoKRXhlY3V0aW9uIEVudmVsb3BlOgpgYGBqc29uCnsic2NoZW1hX3ZlcnNpb24iOiIxLjAuMCIsInJvdXRlIjp7IndvcmtfbW9kZSI6IuWun+ijhSIsIm9wZXJhdGluZ19tb2RlIjoiZGVsaXZlcnlfcXVhbGl0eSIsInVzZXJfZmFjaW5nIjoiLi4uIiwiaW50ZXJuYWwiOnsicHJpbWFyeSI6InRlc3QtZmlyc3QtdmVyaWZpY2F0aW9uIn19LCJldmlkZW5jZV9zdGF0dXMiOnsiY2hlY2tlZCI6W10sIm1pc3NpbmciOltdfSwic3RvcF9yZWFzb24iOnsic3RhdHVzIjoibm9uZSIsImRldGFpbHMiOltdLCJodW1hbl9kZWNpc2lvbl9yZXF1aXJlZCI6W10sInN0b3BfaWYiOltdfSwibmV4dF9hY3Rpb24iOiIuLi4ifQpgYGAKCiRBUkdVTUVOVFMK","encoding":"base64","media_type":"text/markdown; charset=utf-8","path":"adapters/codex/prompts/skill-verify.md","raw_digest":"sha256:0fb394cd590cfd00215e581d3d159a31967437f039156f5e5e3d6b4f1b157b82"}],"object_kind":"asset_content_package","package_format":"canonical_json_base64_files","schema_version":"1.0.0","type_extension":{"adapter":"codex","entrypoint":"adapters/codex/prompts/skill-verify.md","kind":"prompt_template","rendered_runtime_content":false}}
